{
  "$schema": "https://json-schema.org/draft/2020-12/schema",
  "$id": "https://contracts.loan-platform.example/schemas/events/customer-identity-verified.v1.schema.json",
  "title": "CustomerIdentityVerified.v1",
  "type": "object",
  "additionalProperties": false,
  "properties": {
    "eventId": {
      "type": "string",
      "minLength": 1
    },
    "eventType": {
      "const": "CustomerIdentityVerified.v1"
    },
    "eventVersion": {
      "const": 1
    },
    "occurredAt": {
      "type": "string",
      "format": "date-time",
      "pattern": "^\\d{4}-\\d{2}-\\d{2}T\\d{2}:\\d{2}:\\d{2}(?:\\.\\d+)?Z$"
    },
    "aggregateId": {
      "type": "string",
      "minLength": 1
    },
    "correlationId": {
      "type": "string",
      "minLength": 1
    },
    "causationId": {
      "type": "string",
      "minLength": 1
    },
    "producer": {
      "const": "CustomerAndIdentity"
    },
    "traceId": {
      "type": "string",
      "minLength": 1
    },
    "payload": {
      "type": "object",
      "additionalProperties": false,
      "properties": {
        "applicationId": {
          "type": "string",
          "minLength": 1
        },
        "customerId": {
          "type": "string",
          "minLength": 1
        },
        "verificationId": {
          "type": "string",
          "minLength": 1
        },
        "verificationLevel": {
          "type": "string",
          "minLength": 1
        },
        "verifiedAt": {
          "type": "string",
          "format": "date-time",
          "pattern": "^\\d{4}-\\d{2}-\\d{2}T\\d{2}:\\d{2}:\\d{2}(?:\\.\\d+)?Z$"
        },
        "validUntil": {
          "type": "string",
          "format": "date-time",
          "pattern": "^\\d{4}-\\d{2}-\\d{2}T\\d{2}:\\d{2}:\\d{2}(?:\\.\\d+)?Z$"
        }
      },
      "required": [
        "applicationId",
        "customerId",
        "verificationId",
        "verificationLevel",
        "verifiedAt",
        "validUntil"
      ]
    }
  },
  "required": [
    "eventId",
    "eventType",
    "eventVersion",
    "occurredAt",
    "aggregateId",
    "correlationId",
    "causationId",
    "producer",
    "traceId",
    "payload"
  ]
}
